{
  "schema": 1,
  "trainee_id": "T1",
  "session_id": "3f6c1e9a-0b7d-4a51-9a52-0c3c0d2f8e11",
  "source": "live",
  "device": "SM-R920",
  "samples": [
    {"t": 1791700000000, "bpm": 92},
    {"t": 1791700001000, "bpm": 93},
    {"t": 1791700002000, "bpm": 93},
    {"t": 1791700003000, "bpm": 94},
    {"t": 1791700004000, "bpm": 95}
  ]
}
